{
  "mas_cr1_version": "1",
  "schema_version": "1",
  "projection_identity": "0193e8d5-6f5a-7b1c-9d2e-3f4a5b6c7d91",
  "governed_state_reference": {
    "reference": "bitgov:governed-state:proving-slice:0004"
  },
  "authorization_outcome": "UNRESOLVED",
  "request_binding": {
    "principal": {
      "identity": "bitgov:principal:archivist-042"
    },
    "action": {
      "identity": "bitgov:action:read-record"
    },
    "resource": {
      "identity": "bitgov:resource:record-7f3a"
    },
    "context": {
      "identity": "bitgov:context:reading-room-a"
    },
    "scope": {
      "identity": "bitgov:scope:reading-room-a.read-only"
    }
  },
  "constitutional_applicability": "NOT_APPLICABLE",
  "finality_vector": [
    {
      "requirement": "constitutional-evaluation",
      "state": "REQUIRED_AND_UNRESOLVED"
    }
  ],
  "finality_aggregate": "NOT_FINAL",
  "lifecycle_state": "ACTIVE",
  "execution_reliance_effect": "EFFECT_UNRESOLVED",
  "temporal_evaluation_and_currency": {
    "evaluation_point": "2026-09-30T12:00:00Z",
    "currency_state": "CURRENCY_CURRENT"
  },
  "predicate_assertions": {
    "authorization_bounds_exist": {
      "value": "UNRESOLVED",
      "determination_reference": "det:bounds:0004",
      "basis_unknown": true,
      "lineage": {
        "rule_reference": "bitgov:rule:reading-room-access",
        "rule_version": "2026-09-01",
        "authority_basis": "bitgov:governed:basis:proving-slice-v1",
        "lineage_reference": "det:bounds:0004"
      }
    },
    "representation_participates": {
      "value": "FALSE",
      "determination_reference": "det:representation:0004",
      "lineage": {
        "rule_reference": "bitgov:rule:reading-room-access",
        "rule_version": "2026-09-01",
        "authority_basis": "bitgov:governed:basis:proving-slice-v1",
        "lineage_reference": "det:representation:0004"
      }
    },
    "agent_specific": {
      "value": "FALSE",
      "determination_reference": "det:agent:0004",
      "lineage": {
        "rule_reference": "bitgov:rule:reading-room-access",
        "rule_version": "2026-09-01",
        "authority_basis": "bitgov:governed:basis:proving-slice-v1",
        "lineage_reference": "det:agent:0004"
      }
    },
    "appeal_applicability": {
      "value": "FALSE",
      "determination_reference": "det:appeal:0004",
      "lineage": {
        "rule_reference": "bitgov:rule:reading-room-access",
        "rule_version": "2026-09-01",
        "authority_basis": "bitgov:governed:basis:proving-slice-v1",
        "lineage_reference": "det:appeal:0004"
      }
    },
    "escalation_applicability": {
      "value": "FALSE",
      "determination_reference": "det:escalation:0004",
      "lineage": {
        "rule_reference": "bitgov:rule:reading-room-access",
        "rule_version": "2026-09-01",
        "authority_basis": "bitgov:governed:basis:proving-slice-v1",
        "lineage_reference": "det:escalation:0004"
      }
    },
    "governed_basis_exists": {
      "value": "UNRESOLVED",
      "determination_reference": "det:basis:0004",
      "basis_unknown": true,
      "lineage": {
        "rule_reference": "bitgov:rule:reading-room-access",
        "rule_version": "2026-09-01",
        "authority_basis": "bitgov:governed:basis:proving-slice-v1",
        "lineage_reference": "det:basis:0004"
      }
    },
    "evaluation_had_scope": {
      "value": "FALSE",
      "determination_reference": "det:scope:0004",
      "lineage": {
        "rule_reference": "bitgov:rule:reading-room-access",
        "rule_version": "2026-09-01",
        "authority_basis": "bitgov:governed:basis:proving-slice-v1",
        "lineage_reference": "det:scope:0004"
      }
    },
    "governed_temporal_rules_apply": {
      "value": "FALSE",
      "determination_reference": "det:temporal:0004",
      "lineage": {
        "rule_reference": "bitgov:rule:reading-room-access",
        "rule_version": "2026-09-01",
        "authority_basis": "bitgov:governed:basis:proving-slice-v1",
        "lineage_reference": "det:temporal:0004"
      }
    }
  },
  "unresolved_reasons": [
    {
      "reason_key": "constitutional-evaluation-unresolved",
      "detail": "applicable constitutional evaluation could not be established; no disposition manufactured"
    },
    {
      "reason_key": "authorization-bounds-unknown",
      "detail": "existence of authorization bounds could not be established"
    }
  ]
}
