{
  "mas_cr1_version": "1",
  "schema_version": "1",
  "projection_identity": "0193e8d5-6f5a-7b1c-9d2e-3f4a5b6c7d90",
  "governed_state_reference": {
    "reference": "bitgov:governed-state:proving-slice:0003"
  },
  "authorization_outcome": "NO-GOVERNED-DECISION",
  "request_binding": {
    "principal": {
      "identity": "bitgov:principal:archivist-042"
    },
    "action": {
      "identity": "bitgov:action:read-record"
    },
    "resource": {
      "identity": "bitgov:resource:record-7f3a"
    },
    "context": {
      "identity": "bitgov:context:reading-room-a"
    },
    "scope": {
      "identity": "bitgov:scope:reading-room-a.read-only"
    }
  },
  "constitutional_applicability": "NOT_APPLICABLE",
  "finality_vector": [
    {
      "requirement": "competence-finding",
      "state": "NOT_APPLICABLE"
    }
  ],
  "lifecycle_state": "ACTIVE",
  "execution_reliance_effect": "EFFECT_NOT_APPLICABLE",
  "temporal_evaluation_and_currency": {
    "evaluation_point": "2026-09-30T12:00:00+00:00",
    "currency_state": "CURRENCY_CURRENT"
  },
  "predicate_assertions": {
    "authorization_bounds_exist": {
      "value": "FALSE",
      "determination_reference": "det:bounds:0003",
      "lineage": {
        "rule_reference": "bitgov:rule:reading-room-access",
        "rule_version": "2026-09-01",
        "authority_basis": "bitgov:governed:basis:proving-slice-v1",
        "lineage_reference": "det:bounds:0003"
      }
    },
    "representation_participates": {
      "value": "FALSE",
      "determination_reference": "det:representation:0003",
      "lineage": {
        "rule_reference": "bitgov:rule:reading-room-access",
        "rule_version": "2026-09-01",
        "authority_basis": "bitgov:governed:basis:proving-slice-v1",
        "lineage_reference": "det:representation:0003"
      }
    },
    "agent_specific": {
      "value": "FALSE",
      "determination_reference": "det:agent:0003",
      "lineage": {
        "rule_reference": "bitgov:rule:reading-room-access",
        "rule_version": "2026-09-01",
        "authority_basis": "bitgov:governed:basis:proving-slice-v1",
        "lineage_reference": "det:agent:0003"
      }
    },
    "appeal_applicability": {
      "value": "FALSE",
      "determination_reference": "det:appeal:0003",
      "lineage": {
        "rule_reference": "bitgov:rule:reading-room-access",
        "rule_version": "2026-09-01",
        "authority_basis": "bitgov:governed:basis:proving-slice-v1",
        "lineage_reference": "det:appeal:0003"
      }
    },
    "escalation_applicability": {
      "value": "FALSE",
      "determination_reference": "det:escalation:0003",
      "lineage": {
        "rule_reference": "bitgov:rule:reading-room-access",
        "rule_version": "2026-09-01",
        "authority_basis": "bitgov:governed:basis:proving-slice-v1",
        "lineage_reference": "det:escalation:0003"
      }
    },
    "governed_basis_exists": {
      "value": "TRUE",
      "determination_reference": "det:basis:0003",
      "lineage": {
        "rule_reference": "bitgov:rule:reading-room-access",
        "rule_version": "2026-09-01",
        "authority_basis": "bitgov:governed:basis:proving-slice-v1",
        "lineage_reference": "det:basis:0003"
      }
    },
    "evaluation_had_scope": {
      "value": "FALSE",
      "determination_reference": "det:scope:0003",
      "lineage": {
        "rule_reference": "bitgov:rule:reading-room-access",
        "rule_version": "2026-09-01",
        "authority_basis": "bitgov:governed:basis:proving-slice-v1",
        "lineage_reference": "det:scope:0003"
      }
    },
    "governed_temporal_rules_apply": {
      "value": "FALSE",
      "determination_reference": "det:temporal:0003",
      "lineage": {
        "rule_reference": "bitgov:rule:reading-room-access",
        "rule_version": "2026-09-01",
        "authority_basis": "bitgov:governed:basis:proving-slice-v1",
        "lineage_reference": "det:temporal:0003"
      }
    }
  },
  "absence_evidence": [
    {
      "finding": "GOVERNED_ABSENCE_FOUND",
      "applicability_determination_reference": "det:absence:0003",
      "scope_reference": "bitgov:scope:reading-room-a.read-only",
      "lineage": {
        "rule_reference": "bitgov:rule:reading-room-access",
        "rule_version": "2026-09-01",
        "authority_basis": "bitgov:governed:basis:proving-slice-v1",
        "lineage_reference": "det:absence:0003"
      }
    }
  ],
  "authority_lineage": {
    "rule_reference": "bitgov:rule:reading-room-access",
    "rule_version": "2026-09-01",
    "authority_basis": "bitgov:governed:basis:proving-slice-v1",
    "lineage_reference": "det:basis:0003"
  }
}
