{"authority_lineage":{"authority_basis":"bitgov:governed:basis:proving-slice-v1","lineage_reference":"det:basis:0001","rule_reference":"bitgov:rule:reading-room-access","rule_version":"2026-09-01"},"authorization_outcome":"AUTHORIZED","constitutional_applicability":"APPLICABLE","constitutional_disposition":"ADMISSIBLE","constraints":[{"constraint_type":"TEST_FIXTURE_ONLY_IDENTITY_ALLOWLIST","restriction":{"field":"action","permitted_identities":["bitgov:action:read-record"]},"statement":"TEST_FIXTURE_ONLY: permit only the bound read-record action"}],"context_scope_detail":{"context_reference":"bitgov:context:reading-room-a","scope_reference":"bitgov:scope:reading-room-a.read-only"},"execution_reliance_effect":"RELIANCE_PERMITTED","finality_aggregate":"FINAL","finality_vector":[{"requirement":"constitutional-evaluation","state":"REQUIRED_AND_SATISFIED"},{"requirement":"competence-finding","state":"REQUIRED_AND_SATISFIED"},{"requirement":"participation","state":"NOT_APPLICABLE"}],"governed_state_reference":{"reference":"bitgov:governed-state:proving-slice:0001"},"lifecycle_state":"ACTIVE","mas_cr1_version":"1","predicate_assertions":{"agent_specific":{"determination_reference":"det:agent:0001","lineage":{"authority_basis":"bitgov:governed:basis:proving-slice-v1","lineage_reference":"det:agent:0001","rule_reference":"bitgov:rule:reading-room-access","rule_version":"2026-09-01"},"value":"FALSE"},"appeal_applicability":{"determination_reference":"det:appeal:0001","lineage":{"authority_basis":"bitgov:governed:basis:proving-slice-v1","lineage_reference":"det:appeal:0001","rule_reference":"bitgov:rule:reading-room-access","rule_version":"2026-09-01"},"value":"FALSE"},"authorization_bounds_exist":{"determination_reference":"det:bounds:0001","lineage":{"authority_basis":"bitgov:governed:basis:proving-slice-v1","lineage_reference":"det:bounds:0001","rule_reference":"bitgov:rule:reading-room-access","rule_version":"2026-09-01"},"value":"TRUE"},"escalation_applicability":{"determination_reference":"det:escalation:0001","lineage":{"authority_basis":"bitgov:governed:basis:proving-slice-v1","lineage_reference":"det:escalation:0001","rule_reference":"bitgov:rule:reading-room-access","rule_version":"2026-09-01"},"value":"FALSE"},"evaluation_had_scope":{"determination_reference":"det:scope:0001","lineage":{"authority_basis":"bitgov:governed:basis:proving-slice-v1","lineage_reference":"det:scope:0001","rule_reference":"bitgov:rule:reading-room-access","rule_version":"2026-09-01"},"value":"TRUE"},"governed_basis_exists":{"determination_reference":"det:basis:0001","lineage":{"authority_basis":"bitgov:governed:basis:proving-slice-v1","lineage_reference":"det:basis:0001","rule_reference":"bitgov:rule:reading-room-access","rule_version":"2026-09-01"},"value":"TRUE"},"governed_temporal_rules_apply":{"determination_reference":"det:temporal:0001","lineage":{"authority_basis":"bitgov:governed:basis:proving-slice-v1","lineage_reference":"det:temporal:0001","rule_reference":"bitgov:rule:reading-room-access","rule_version":"2026-09-01"},"value":"TRUE"},"representation_participates":{"determination_reference":"det:representation:0001","lineage":{"authority_basis":"bitgov:governed:basis:proving-slice-v1","lineage_reference":"det:representation:0001","rule_reference":"bitgov:rule:reading-room-access","rule_version":"2026-09-01"},"value":"FALSE"}},"projection_identity":"0193e8d5-6f5a-7b1c-9d2e-3f4a5b6c7d8e","request_binding":{"action":{"identity":"bitgov:action:read-record"},"context":{"identity":"bitgov:context:reading-room-a"},"principal":{"identity":"bitgov:principal:archivist-042"},"resource":{"identity":"bitgov:resource:record-7f3a"},"scope":{"identity":"bitgov:scope:reading-room-a.read-only"}},"rules_relied_upon":[{"applicability":"APPLICABLE","authority_reference":"bitgov:governed:basis:proving-slice-v1","rule_identity":"bitgov:rule:reading-room-access","version":"2026-09-01"}],"schema_version":"1","temporal_evaluation_and_currency":{"currency_state":"CURRENCY_CURRENT","evaluation_point":"2026-09-30T12:00:00Z","temporal_bounds_reference":"bitgov:temporal-bounds:proving-slice:0001"}}
